{
  "schema": "component-record/v1",
  "subject": "church",
  "source": {
    "shellPath": "regularize/church/artifact.json",
    "sha256": "02e78adb5cd445ac97d125bb0c6d55fdf42c7a3382d25ad036b9f15a52b2e83e",
    "regularized": true
  },
  "alignment": {
    "mode": "registry-scale",
    "scales": [
      48.005977421214155,
      48.005977421214155,
      48.005977421214155
    ],
    "voxelSize": 0.021
  },
  "bounds": {
    "min": [
      -24,
      0,
      -19
    ],
    "max": [
      23,
      32,
      19
    ]
  },
  "masses": [
    {
      "id": "mass-0",
      "role": "primary",
      "protected": false,
      "plan": {
        "runs": [
          {
            "z": -8,
            "x0": -24,
            "x1": -21
          },
          {
            "z": -7,
            "x0": -24,
            "x1": -7
          },
          {
            "z": -7,
            "x0": -2,
            "x1": -2
          },
          {
            "z": -6,
            "x0": -24,
            "x1": -7
          },
          {
            "z": -6,
            "x0": -2,
            "x1": -2
          },
          {
            "z": -5,
            "x0": -24,
            "x1": -21
          },
          {
            "z": -5,
            "x0": -18,
            "x1": -7
          },
          {
            "z": -5,
            "x0": -2,
            "x1": -2
          },
          {
            "z": -4,
            "x0": -24,
            "x1": -21
          },
          {
            "z": -4,
            "x0": -18,
            "x1": -7
          },
          {
            "z": -4,
            "x0": -2,
            "x1": -2
          },
          {
            "z": -3,
            "x0": -24,
            "x1": -21
          },
          {
            "z": -3,
            "x0": -18,
            "x1": -7
          },
          {
            "z": -3,
            "x0": -2,
            "x1": -2
          },
          {
            "z": -2,
            "x0": -24,
            "x1": -21
          },
          {
            "z": -2,
            "x0": -18,
            "x1": 23
          },
          {
            "z": -1,
            "x0": -24,
            "x1": -21
          },
          {
            "z": -1,
            "x0": -18,
            "x1": 23
          },
          {
            "z": 0,
            "x0": -24,
            "x1": -21
          },
          {
            "z": 0,
            "x0": -18,
            "x1": 23
          },
          {
            "z": 1,
            "x0": -24,
            "x1": 23
          },
          {
            "z": 2,
            "x0": -24,
            "x1": 23
          },
          {
            "z": 3,
            "x0": -24,
            "x1": 23
          },
          {
            "z": 4,
            "x0": -24,
            "x1": 23
          },
          {
            "z": 5,
            "x0": -24,
            "x1": 23
          },
          {
            "z": 6,
            "x0": -24,
            "x1": 23
          },
          {
            "z": 7,
            "x0": -24,
            "x1": 23
          },
          {
            "z": 8,
            "x0": -24,
            "x1": 23
          },
          {
            "z": 9,
            "x0": -24,
            "x1": 23
          },
          {
            "z": 10,
            "x0": -24,
            "x1": 23
          },
          {
            "z": 11,
            "x0": -24,
            "x1": 23
          },
          {
            "z": 12,
            "x0": -24,
            "x1": 23
          },
          {
            "z": 13,
            "x0": -24,
            "x1": 23
          },
          {
            "z": 14,
            "x0": -24,
            "x1": 23
          },
          {
            "z": 15,
            "x0": -24,
            "x1": 23
          },
          {
            "z": 16,
            "x0": -24,
            "x1": 23
          },
          {
            "z": 17,
            "x0": -24,
            "x1": 23
          },
          {
            "z": 18,
            "x0": -24,
            "x1": 23
          },
          {
            "z": 19,
            "x0": -20,
            "x1": 23
          }
        ],
        "bbox": {
          "minX": -24,
          "maxX": 23,
          "minZ": -8,
          "maxZ": 19
        },
        "area": 1139
      },
      "yRange": [
        0,
        23
      ],
      "volume": 12491,
      "junctions": [
        {
          "withMass": "mass-4",
          "kind": "base",
          "cells": [
            {
              "z": -5,
              "x0": -20,
              "x1": -19
            },
            {
              "z": -4,
              "x0": -20,
              "x1": -19
            },
            {
              "z": -3,
              "x0": -20,
              "x1": -19
            },
            {
              "z": -2,
              "x0": -20,
              "x1": -19
            },
            {
              "z": -1,
              "x0": -20,
              "x1": -19
            },
            {
              "z": 0,
              "x0": -20,
              "x1": -19
            }
          ],
          "yRange": [
            17,
            17
          ]
        },
        {
          "withMass": "mass-1",
          "kind": "side",
          "cells": [
            {
              "z": -8,
              "x0": -24,
              "x1": -21
            },
            {
              "z": -7,
              "x0": -17,
              "x1": -7
            }
          ],
          "yRange": [
            0,
            23
          ]
        },
        {
          "withMass": "mass-2",
          "kind": "side",
          "cells": [
            {
              "z": -2,
              "x0": 1,
              "x1": 3
            }
          ],
          "yRange": [
            7,
            7
          ]
        }
      ]
    },
    {
      "id": "mass-1",
      "role": "attached",
      "protected": false,
      "plan": {
        "runs": [
          {
            "z": -19,
            "x0": -24,
            "x1": -7
          },
          {
            "z": -18,
            "x0": -24,
            "x1": -7
          },
          {
            "z": -17,
            "x0": -24,
            "x1": -7
          },
          {
            "z": -16,
            "x0": -24,
            "x1": -7
          },
          {
            "z": -15,
            "x0": -24,
            "x1": -7
          },
          {
            "z": -14,
            "x0": -24,
            "x1": -7
          },
          {
            "z": -13,
            "x0": -24,
            "x1": -7
          },
          {
            "z": -12,
            "x0": -24,
            "x1": -7
          },
          {
            "z": -11,
            "x0": -24,
            "x1": -7
          },
          {
            "z": -10,
            "x0": -24,
            "x1": -7
          },
          {
            "z": -9,
            "x0": -24,
            "x1": -21
          },
          {
            "z": -9,
            "x0": -18,
            "x1": -7
          },
          {
            "z": -8,
            "x0": -17,
            "x1": -7
          }
        ],
        "bbox": {
          "minX": -24,
          "maxX": -7,
          "minZ": -19,
          "maxZ": -8
        },
        "area": 207
      },
      "yRange": [
        0,
        32
      ],
      "volume": 3957,
      "junctions": [
        {
          "withMass": "mass-3",
          "kind": "base",
          "cells": [
            {
              "z": -9,
              "x0": -20,
              "x1": -19
            },
            {
              "z": -8,
              "x0": -20,
              "x1": -18
            }
          ],
          "yRange": [
            30,
            30
          ]
        },
        {
          "withMass": "mass-0",
          "kind": "side",
          "cells": [
            {
              "z": -9,
              "x0": -24,
              "x1": -21
            },
            {
              "z": -8,
              "x0": -17,
              "x1": -7
            }
          ],
          "yRange": [
            0,
            23
          ]
        }
      ]
    },
    {
      "id": "mass-2",
      "role": "attached",
      "protected": false,
      "plan": {
        "runs": [
          {
            "z": -7,
            "x0": 1,
            "x1": 3
          },
          {
            "z": -6,
            "x0": 3,
            "x1": 3
          },
          {
            "z": -5,
            "x0": 1,
            "x1": 3
          },
          {
            "z": -4,
            "x0": 1,
            "x1": 3
          },
          {
            "z": -3,
            "x0": 1,
            "x1": 3
          }
        ],
        "bbox": {
          "minX": 1,
          "maxX": 3,
          "minZ": -7,
          "maxZ": -3
        },
        "area": 13
      },
      "yRange": [
        7,
        7
      ],
      "volume": 13,
      "junctions": [
        {
          "withMass": "mass-0",
          "kind": "side",
          "cells": [
            {
              "z": -3,
              "x0": 1,
              "x1": 3
            }
          ],
          "yRange": [
            7,
            7
          ]
        }
      ]
    },
    {
      "id": "mass-3",
      "role": "protrusion",
      "protected": true,
      "plan": {
        "runs": [
          {
            "z": -9,
            "x0": -20,
            "x1": -19
          },
          {
            "z": -8,
            "x0": -20,
            "x1": -18
          }
        ],
        "bbox": {
          "minX": -20,
          "maxX": -18,
          "minZ": -9,
          "maxZ": -8
        },
        "area": 5
      },
      "yRange": [
        31,
        32
      ],
      "volume": 5,
      "junctions": [
        {
          "withMass": "mass-1",
          "kind": "base",
          "cells": [
            {
              "z": -9,
              "x0": -20,
              "x1": -19
            },
            {